people:type,people:manager,people:relatedTo,people:date,jcr:title,jcr:description
people:sentEmail,psmith,"Eldred, Janina",15/02/2014 11:54:11,Price offer,Mail Susan to see what are their offer for the rent of “Braut der Gorilla” for the festival
people:meeting,bsinou,"Eldred, Janina",10/01/2014 10:12:00,Dinner appointment,Discuss plans on cooperation with Salt'nPepper Prod.
people:call,bsinou,"Eldred, Janina",11/09/2013 11:54:11,Phone call,"Very productive conversation, possible jury candidate for Trash section"
people:note,jchan,"Helbling, Ulla",15/01/2014 17:23:08,Possible coop. Partner,Mr. Hering's company produces interesting films – we should get in touch for closer coop. Possibilities
people:sentPostMail,psmith,"Helbling, Ulla",02/02/2014 14:03:42,Invitation to birthday party,
people:sentEmail,jchan,"Helbling, Ulla",08/09/2013 14:54:11,Press release,Sent press release for review
